{
  "actions": "example-value",
  "arn": "arn:aws:ssm-incidents::123456789012:response-plan/example",
  "chatChannel": "example-value",
  "displayName": "example-incident",
  "engagements": "example-value",
  "incidentTemplate": "id-abc123",
  "integrations": "example-value",
  "name": "example-incident"
}